date,comment
2013-11-04T17:15:41-0800,think Mega Pokemon need banned competitive play tend overpowered Reasons Mega Evolving cost anything use recharge cool time Mega Evolve attack changes stats also change turn counter works decrease increase speed base stat Pokemon losing bad typing kept broken top Pokemon Mega Stones dont need hold items begin benefit Mega Stone gaining power losing bad typing cool competitve play need banned reason Lati Twins cant hold Soul Dew rumor even Lati Twins getting Mega forms
2013-11-04T17:43:04-0800,Mega Ampharos improved imo several reasonsMold Breaker cancels several useful abilities contains Protean Sturdy Natural Cure Technician Harvest Magic Guard Speed Boost Huge Power Contrary Parental Bond Shadow Tag etcElectricDragon gained resistance happens 4x Electric Fire Grass WaterBuffed Satk along better Def SdefCan thrown Trick Room TeamThe negatives areHe gained weaknesses Ice Dragon FairySlowRequires Pokemon support Ampharos make effectiveShallow movepoolOverall Ampharos one Pokemon tons unique properties impractical several situations terms Pokemon going natural base stats wont see often better Mega Pokemon use Mega Stone cant use second one remainder battle However player encounter Ampharos use elements surprise advantage play cards right
2013-11-05T13:59:45-0800,agree many overpowered honest needed boost Manectric Houndoom Mawile Medicham lot Pokmon seem weak compared Pokmon labeled overpowered Garchomp Gengar even XY think lot Pokmon received Megas needed competitive merit Plus aint much chance Mega Evos banned mean yeah theyre strong banned since trigger one Mega per battle would hold anyone back using many isnt autowin use one
2013-11-11T12:08:37-0800,think relative strength bit misleadinglets consider Mega Heracross example big 185 Atk scary reality Gutsboosted Heracross actually hit harder mention mega form slower also gains completely different ability Skill Link forcing run completely different moves really want take advantage Garchomp loses speed well Mega evolve Garchomps speed tier 102 extremely useful outspeeding base 100s turns bit sitting duck Pokemon like Hydreigon KO Draco Meteor would otherwise outsped Mega Gyarados gains Dark loses Flying type smacked around easily Fighting attacks used laugh Manetricwell Manetric still pretty useless making faster harder hitting Jolteon Intimidate doesnt really muchI guess bottom line give something use mega form cases like Mega Mawile Kangeshkan clearly superior really gain lot mega evolving compared normal forms Otherwise cases basically akin putting Life Orb damage recoil maybe speed boost adding bulkiness cost speed Consider also hold mega stone losing potentially valuable items like Leftovers Choice Scarf Sitrus Berry typereducing berry etc powerful used right dont really see gamebreaking really
2013-11-17T04:16:13-0800,Yeah noticed mega Ampharos isnt good Perhaps might one Im impressed compared ones games Im looking forward able port pokemon near end year Maybe make better competitive pokemon previous versions
2013-11-17T07:47:43-0800,quick question use mawile scizor team attach mega stone
2013-11-17T15:57:48-0800,Kinda depends team really basic general statement Mawile prefers TRoriented teams Scizor usually function well thanks typing Bullet Punch needs usually SD belt start wrecking things BP Bug Bite
2013-11-17T16:07:11-0800,Ummm yeah realize Im little slow could please repeat english LOLPlease define following TRoriented teams SD belt BPThanks
2013-11-17T21:09:55-0800,Lol problemBP Bullet PunchTR Trick RoomSD Swords DanceSo basically Mawile works best Trick Room since speed bad lacks priority moves Trick Room reverses speed becomes one faster Pokemon 5 turns Scizor despite ok Speed doesnt need Trick Room since strong priority move Bullet Punch lets attack first regardless Combined Swords Dance boost attack wrecks havoc Pokemon dont resist moves
2013-11-18T17:17:48-0800,Mawile gets Sucker Punch learned hard way Took Floatzel Zangoose one hit 50 percent Zapdos
2013-11-18T19:04:50-0800,Well wit Megas around hope format become stale repetitious meta Megas think problems heavily considering Pokemon playable course restriction systemSay team 6 bring 6 pick 4no duplicate hold itemsno duplicate Pokmon1 legendry1 mega stone hold item onlyjust thought
2013-11-18T20:43:19-0800,Alright next question slightly topic really whats best way raise Scyther great Scizor use mega stone think might better without Im also thinking natures characteristics movesets happen know find best pokemon raise effort values also access Pokemon Black Black 2 helpIve always liked Scizor Volcarona inclusions teams Hopefully one really useful format
2013-11-18T22:04:59-0800,Duh good point forget thatfor reason given large flytrap Crunch comes mind beforehand lolHonest answer Breed raise Scizor one BlackWhite 2 carts get Bug Bite Move Tutor Without youre stuck XScissor isnt boosted Technician Adamant way go Nature probably looking something like Swords DanceBullet PunchBug BiteProtect moveset least doubles singles drop Protect something like Pursuit another utility attack whenever Pokebank comes next month transfer Volcarona still pretty useful Quiver Dance typing still powerhouse watch Rock attacks
2013-11-19T08:06:02-0800,Since speed wont really issue Macho Brace training Scizor
2013-11-20T06:30:35-0800,assuming X maybe super training reset bag think called dont worry EVs latter get perfect
2013-11-21T12:46:07-0800,IMO Scizor plenty fine without Mega youre probably better using another Mega saying Mega Scizor bad Scizor already good might well invest Mega something really change game
2013-11-24T13:28:17-0800,Ok good comment feel opinion valid one mega opinion worth change game
2013-11-24T13:50:49-0800,like Mega Kangakhan seems well school next Mega Mawile OP set seems PowerUp Punch EarthquakeReturn Sucker Punch Fake
2013-11-26T00:46:54-0800,really sure quite yet Im starting toy around teams Mega Kangaskahn Mega Mawile seem pretty good previously stated Mega Banette getting Prankster Wisp also interesting Mega Gyrados also pretty interesting becomes bulky still retains enough speed use Dragon Dance great effect really depends team support otherAs much loathe redundancy Singles Mega Abomasnow Mega Tyranitar could pretty brutal Doubles IMO able reactivate abilities Mega Charizards Drought Mega Abomasnow becoming even slower certainly frightening TR
2013-12-18T02:58:39-0800,find Mega Gyrados interestingbypassing Rotoms Levitate EQ Aromatisse Aroma Veil wants taunt 100 later someone tested confirm would great Im 8090 sure Plus gets rid nasty horrific x4 weakness Electric Mega Kang Mega Mawile suited goodstuffs teams pretty versatile think Mega Banette Prankster Taunt niche function well TR team eats Mega evo game suggested moveset would something like WillOWispTauntKnockOffSucker Punch Protect Shadow Claw Mega Charizard alot powerful sun expected havent seen many action
2013-12-18T06:57:33-0800,problem MGyarados give lot made Gyarados good Resistance Grass Fighting immunity Ground Megaevolve suddenly Mach Punch lot threatening Plus weakness Fairy Additionally Gyarados huge variety items benefits Lum Berry Sitrus Berry Life Orb Leftovers Shell Bell gone want MegaFor comparisonGyaradosWeaknesses 2Resistances 5Immunities 1MGyaradosWeaknessesResistances 6Immunities 1Not saying doesnt uses Mold Breaker undeniably good ability requires LOT careful playingscouting threats
2013-12-12T21:45:00-0800,updated Nintendo 3DS recently WiFi connectivity secured go line using 3DSThis update includes new Miiverse synchs 3DS also eShop connection WiFiThere also update version 12 Pokemon XY versions also patches secure connections play game via WiFi featuresFor information use 3DS connect eShop select Pokmon top row find update patchYou also synch Nintendo Club Member account well new updateNintendo making sure WiFi connection secure participating WiFi activities using 3DSeditThis update includes Ver 1 update well 11 already receive 12
2013-12-16T12:04:43-0800,program uses vulnerabilities someone see moveset cheat battle Im certainly glad gone
2013-12-16T16:51:55-0800,batttle analyzer Instacheck program allowed u see stats pokemon u trading stats eggs also gave u number allowed u hatch shiny eggs great source preventing scams allowing u see person U trading doesnt five iv ditto claimed
2013-12-17T04:42:02-0800,Im problem update Pikachu 3DS XL already downloaded file open 3DS says need start Pokemon X internet start update process yeah go friend code software see anyone online notice Im definitely online start game friend code software says Im online doesnt mean Im online game touch internet button top PSS get error code 0020120In order use online services newer version software required Download newest version software Nintendo eShop supported softwareAny ideas anyone
2013-12-17T20:18:21-0800,Ok worries guys update acted weird day download update couple times finally took
2013-11-01T19:13:36-0700,Holy XMen Batman idea could get X exploring Terminus Cave less minding business trying find pokemon might missed practically bumped Im wondering save game case went town Master ball available figured Id try without took 25 timer balls 10 types finally caught itThen shortly Moltres flew fled Im see wizard see words wisdom catching cool pokemonEDIT Yeah dont know impression might able get legendary Pokemon Z came Im glad wrong
2013-11-01T19:14:45-0700,Everyone knew Zygarde even release encounter moltres 12 times sea spirits den
2013-11-01T19:19:51-0700,Hmmm sounds good guess able keep something nice surprise everyone else Im curious else didnt hear new cool
2013-11-01T20:39:41-0700,main gripe much else finish game super happy run zapdos timid nature 3 31 IVs wrong stats makes special though
2013-11-02T10:37:39-0700,legendries least 3 31 IVs good nature certain set made far catching Xernies retry catching didnt use MBI ran Moltres neither two yet
2013-11-02T10:55:53-0700,fight 1 legendaryMoltres FroakieZapdos FennekinArticuno chespin
2013-11-02T13:32:20-0700,like special Zapdos bad speed special attack IVs make unique perfer 31s HP Defense guess Still cant wait get perfect Zapdos game
2013-11-03T01:54:15-0800,wont lie known bird trio tied starters wouldve dropped Froakie heartbeat Fennekin lets face Zapdos worthwhile legendary bird
2013-11-03T02:04:23-0800,tell truth really game moveset bad learn anything thunder moves good tm moves move tutors use Zapdos find switching time cant anything thunderbolt course dont mind using Roost Thunderbolt Volt Switch Light Screen go get Zapdos
2013-11-04T03:25:10-0800,Thats somewhat disappointing However enjoy game far bad stats andor movesets one particular pokemon wont ruin dayEDIT time planned picking opposite game Pokmon current Pokmon X fairly decent reason get Yveltal Tyrantrum legendary birds starters missed one copy game suppose get copy soon pick another copy mystery gift Torchic trading special Torchic event end anyway
2013-11-17T03:48:36-0800,New info global link website Ive learned torchic Blazikenite distribution end Jan 16 2014 dont pick yourpokemon may outta luck
2013-11-17T14:20:37-0800,lol LOL yeah sometimes think youre right made laugh thanks Oh well case may little slow get eventually
2013-12-17T07:08:37-0800,know could checked Zapdos kept catching got one wanted rightI realize could kept catching got wanted get PERFECT Zapdos might bit hard wouldnt
2013-12-17T10:35:42-0800,know could planned already like 5 perfect zapdos one get get pokes black 2
2013-12-17T16:40:32-0800,end getting 5 perfect Zapdos Isnt something like asking perfect spouse LOL Hope wife doesnt see post
2013-12-10T11:53:56-0800,Mind honest didnt sound turned absolutely game However far music like get bike bit snappy thats could call Thats actually good thing really since get bike number times breeding pokemon teamI might missed nice music elsewhere though anyone comment music game liked possibly
2013-12-10T14:24:23-0800,Honestly dont even listen 90 ingame music battlegyme4champion ones said love music older games nothing like retro
2013-12-10T14:48:09-0800,game sounds dont like music well handful tracks like must seem dont fit game
2013-12-10T18:21:18-0800,Okay Wow thought alone Maybe wasnt crazy topic first expected
2013-12-10T20:38:57-0800,HonestlyI barely know music games since RedBlue know common tunes stuck since beginningI volume ever recent game actually played game volume new Legend Zelda link worldsFor different feel better gaming experience listen game music home counselI find outofplace time since many games great sound track accompanies game style Even games game counsel pointless style tunes themA game like Zelda games awesome soundtrack Pokmon select tunes find soundtrack XY version bit sorts time round
2013-12-11T13:02:36-0800,like music city Mega guru whatever called Although think would fitting Ecruteak city Johto
2013-12-12T16:34:28-0800,soundtrack game hit miss tracks like Battle XerneasYveltal track really stand awesome IMO Many towns citys fairly bland themesI gotta say glad gave us option change background music wireless battle find setting Gym Leader Champion Legendary themes oftenCyber
2013-12-12T18:49:02-0800,Hmmm must missed one catching Xerneas Either didnt think time Soooo change background music wireless battle Looks like missed option
2013-12-12T21:07:24-0800,player search screen something called Music 1 click Music 1 goes Music 2 goes way Music 11 goes back Music 1
2013-12-13T02:14:27-0800,personally really like lot music really like Snowbelles theme route themes example Different tastes guess
2013-12-12T21:45:00-0800,updated Nintendo 3DS recently WiFi connectivity secured go line using 3DSThis update includes new Miiverse synchs 3DS also eShop connection WiFiThere also update version 12 Pokemon XY versions also patches secure connections play game via WiFi featuresFor information use 3DS connect eShop select Pokmon top row find update patchYou also synch Nintendo Club Member account well new updateNintendo making sure WiFi connection secure participating WiFi activities using 3DSeditThis update includes Ver 11 update well 11 update already receive 12
2013-12-04T19:20:22-0800,thread give quick guide slang used VGVGCI list know add submitteddiscoveredcreatedectIf one would like add post added hereMISCFC Friend Code trade interact Pokemon Players trade battle Pokmon versions XY rely Nintendo 3DSs FC system different past Pokmon game versionsSZFS Safari ZoneFriend SafariEV Effort Values Definition points applied stat increase stat adding one 1 stat stat total done raising Pokmon desired levelIV Individual Value Definition number Pokemons Base Stats ranges 031 31 highest benefit Pokmons end result able max stat using EVs boosting Pokmons performance battleEV Spread way EV Points distributed among base stats totals advantage battle SpeedIV Spread desired range 031 increase decrease Base Stat total max least highest total including level 100 neutral natured PokemonEV Trained Pokmon EV points used specific stats longer benefit points applied stat510 total number EV Points available Pokmon boosting stat Four 4 EV Points needed add 1 stat increase battle wild Pokmon earn EV Points Points amount type go towards raising Pokmons stats able control Points type Pokemon battle againstShiny Pokmon swagHA Hidden AbilityGrunt low level 5 Pokmon trading mostly used trading games transferring friend needs Pokmon give Pokmon reasonEvent Pokmon Pokmon limited distribution via locationWiFi Event Worlds something Special like special attack normally learn game Pokmon keep eyes ears open theseBase StatsThe determining factor maximum stats total value Pokmons leveling process EVs applied influential nature total stat numbers normal experience gained leveling upExample Base StatBulbasaurThese totals max Bulbasaur Base StatsLevel 100NatureHardy neutral nature stat gains 10 10 increasedecrease bonusHit Point 45 max total 294Attack 49 max 197Defense 49 max 197Special Attack 65 max 229Special Defense 65 max 229Speed 45 max 189The total Base stat 318A Pokmon Base Stat totaling Bulbasaurs 318 better battles Bulbasaur comparison therefore Base Stats way choose best option building team using Base Stat scale guidelineHP Hit PointAtt AttackDef DefenseSpAtt Special AttackSPDef Special DefenseSpd SpeedHM Slave Pokmon learn 4 HM moves navigate games map Bidoof good HM Slave learn Surf Rock Smash Cut Strength moves needed get around game almost always partySweeper Pokemon hit hardTankWall Pokemon take many hitsLeadScout Pokemon normally leads team setupBreedingEM Egg Movequad Pokmon 4 31 IV statsquint Pokmon 5 31 IV statsFlawless 6 31 IV statsUntouchedUT Pokmon obtained EV Points applied stat meansBall type Pokeball Pokemon captured breed specific reason Event PokmonAttacksSR Stealth RocksSpinner Pokemon Rapid SpinDefogScreenerDual Screener Pokemon Reflect Light ScreenEntry Hazzards Stealth Rocks Spikes Toxic Spikes Sticky WebDD Dragon DanceHP Hidden PowerBP Bullet PunchSD Swords DanceEQ EarthquakeSTAB Type Attack Bonus Pokmon uses Attack type Pokmon Attack gain power increase 15 times added executed battleBattlesFormat rules used battles Events expected participants follow order able play Event tournament team must comply rules order eligible used specific EventSingles one Pokemon battle field opponents time duration battleDoubles opponent send 2 Pokemon onto battle field time battle continue Pokemon one team eliminated even opponent one Pokemon remainingTriples 3 Pokemon battle team battle continues Pokemon fainted teamthis time atm come feel free post slang know add
2013-12-04T19:55:39-0800,SR Stealth RocksSpinner Pokemon Rapid SpinDefogScreenerDual Screener Pokemon Reflect Light ScreenEntry Hazzards Stealth Rocks Spikes Toxic Spikes Sticky WebDD Dragon DanceSweeper Pokemon hit hardTankWall Pokemon take many hitsLead Pokemon normally leads team setupAll got many others
2013-12-04T20:21:07-0800,think remember seeing one questioned somewhereHA Hidden Ability Pokemon
2013-12-04T21:35:53-0800,Thanks guysmore add Vaporeon switched little classifications post post better fit categories seemed fit better separation although know meant
2013-12-05T07:06:21-0800,Thanks guys certainly appreciate lexicon considering little slow uptake sometimes Ive get explanations number times even things easy guessed long kept Im sure beginning players appreciate wellIn meantime heres another one ask aboutUnder category attack SD Swords Dance
2013-12-05T11:52:41-0800,Also STAB attackSent SCHI545 using Tapatalk
2013-12-05T12:01:45-0800,grass type using grass type attackSent SCHI545 using Tapatalk
2013-12-05T12:41:22-0800,correct Pokemon uses attack thats type pokemon using based power boosted believe 15 times
2013-12-06T13:36:43-0800,UpdatedStill going keep adding bit time anything anyone wants cover post add inThanks far com yall
2013-12-08T16:51:52-0800,EQ Earthquake rather common term Ive seen
2013-11-22T18:29:04-0800,different sure especially since Dark Void Smeargle free try terrorizing opponents
2013-11-22T22:46:35-0800,Zapdos destine bad VGC rules first tournament forever true Im playing game anymore spent WAY much time raising Pokemon
2013-11-23T04:35:35-0800,Great means Im going breed entire team Pokemon championship know timeconsuming unfair CroatianNidoking
2013-11-23T10:48:32-0800,may time consuming seem unfair may able use transported Pokmon price need pay new implementation trying stop cheating tournamentsHere ways quicken pace get team 6Partner friend thisYou breed Pokmon want way trade breed Pokmon REASON Traded Pokmon gain experience faster feel free use Lucky EggThis cut time since raising Pokmon gain average pace leveling upUse Feathers Vitamins Power training get EVs fasterBreed SZ Pokmon use Destiny Knot Power Bracelets breeding Toss EverstoneFind hordes boost EVs obtained EV trainingUse Pokerus finding person trade Pokie rather easyYou need raise Pokmon level 50 EV level 1 using newer methods techs battle worthy Pokmon less time thinkLook stink switch new switch new major step best direction competitive sceneI write article bust tourney worthy Pokmon time new mechs techs game
2013-11-23T11:11:28-0800,biggest deal Pokemon use good Gen 6 lack good move tutors also work go school full time Im working movie keep busy 3 years time breed train new Pokemon also makes Pokemon Bank software worth absolutely worthless nothing bring cant used anything official need kill rule fire completely unfair players spent time energy andor money play someone train Pokemon
2013-11-23T11:11:44-0800,feel pain CN Vaporeon put lot work pokemon Id hoped Id able use pokebank running well Unfortunately even though dont like occasionally play devils advocate guess like somewhat yearly modified announcements trading card game Sure nerfs effort experienced pokemon players put past teams also gives lot new players opportunity playing field sincerely doubt anyone playing since Blue Red entirely happy announcement least resources work stay somewhat competitive TPCi less counting continued playing whether like announcement Lets face us playing years probably going quit due newly introduced ripple Well grumble bit carry find way best work bottom line players equal footing necessarily fun bottom line fairJust know however pokerus given lot Dittos Ive harvested Friend Safari many maxed IVs Im willing supply friends gym service less free charge put friend code pm youve done Give code well find time trade whatever like help great thats Im Im favor everyone
2013-11-23T11:26:36-0800,rule effectively ruins lot people XY lacks past Gens current work load cant train pokemon way many take reason continue play pokemon competitively anymore like trying force older players
2013-11-23T14:19:54-0800,could possible test run done make certain new system works transfer system understanding going filter cheatedhacked Pokmon Things like level 9 Dialgas sortWhen people ask fair need understand accept changes made accomplish goal fairness across boardChange supposed good everyone likes change Understandable look changes made requested changes madeYou want battle via wifi really want lose hackedcheated team Would like see wifi tournies prizesSure losing great amount past work Pokies breed tournies changes outweighs many times personal hard ork went drain hackedcheated teamI agree PA change come long time ago thee enough support demand fairness VGC sceneThis victory cheathack past work wasted made better competitive player aroundI played since RedBlue days many times defeated cheatedhacked teams aroundThis change transferred TCGs Spirit game aspect domain turf knowing striving forward make efforts build best team undefeated strategy reward backed TCPI Nintendo Gamefreakand VGC player baseBelieve Pokemon RNGd W2 cart cart many years transfereventbreed name thereI take pride knowing stuff legit histories victories proof takes one among best trainers battles thereSure compete trading staffing still hang best know least effort changes intentions better VGCI liked many changes allowed changing formats still pull one way shape form anotherYou alone ad people willing assist fellow VGrs outLook wayI like help know help know return give great battle make take 1st place tourney helped share victory littleI going old man one day day look back laugh change complain new changesbut changes take trainer away since game brings type gaming enjoyI simply drudge changes like past knowing efforts done keep ripped victory time truly wastedI take change heart beat losing cheater wasted time way worse format change handNot suckup say thanks TCPINintendoGamefreak listening player base victory cheating hacking time far better small complaint changes format
2013-11-23T15:14:08-0800,fair use collage students school full time work projects working make money lives allowing us use Pokemon spent years raising places us disadvantage thousands people affected sentence Hack checks always place games getting better finding feels like selling every adult plays competitively
2013-11-23T17:17:10-0800,Stickd information leaving one open discussion
2013-11-23T21:36:18-0800,also isnt fair new players havent invested much time games veteran players disposalIm personally favor stops old hacked Pokemon b gives chance players dissuaded playing due complexities raising team way everyone even ground plus current IV breeding mechanincs easily replicate Pokemon meaning wont much time sink anyway took less day get satisfactory Greninja 5 IVs build thatThis probably years format anyway first BW format restrictions BW Pokemon obviously didnt last
2013-11-24T13:56:47-0800,dont problem rules first tournament nothing saying rules change pretty big deal fair fair already work one know Im fair play cutting age group time train breed anymore far fairNow know still use Pokemon causal play friends intend want use competitively Many Pokemon around since Gen 3 still use mean lot data cart lot changes Pokemon making affecting personal life Im starting feel alienated Im sure Im feels way
2013-11-24T14:06:29-0800,secret happiness Vaporeon take personally Perhaps might good step back distance situation see things different light worth
2013-11-24T14:20:24-0800,Perhaps need hard though something care passionately
2013-11-24T14:53:15-0800,share data bit degree attatchment Normal passion involvedThe one thing keeps dislike new changesPassion care changes way obstacles know adjust remaining happy deriving happiness based original reason passionate something first place
2013-11-24T18:05:19-0800,realize rules pretty much support legal Dark Void move learned Darkrai officially released event Pokemon Smeargle learns Sketch ingame move Breed Smeargle XY transfer Darkrai via Pokebank Sketch Dark Void Thats normally specifically ban moves like Dark Void Darkrai normally banned Pokemon naturally learns Smeargle Sketch
