date,comment
2014-06-08T16:34:56-0700,working trade thread system members trading resource meantime please follow simple little guidelinesThis thread used posting wantsoffers Pokmon games Please editupdate main post reflect changes offers wants please use PM system communications make tradesTrading discretion definition fair trade party involvedPlease make sure FC Posted Post post deleted FC Posting SignaturePlease list Pokmon manner similar example whether offering looking trade forWanted OfferingGarchomp shiny shinyAdamant natureIV 313131313131Ability Sand VailHold item anyPlease PM trading detailsFC PokemonsruleAgain working system make trading easy process everyone use advantage member base thread temporally pinned changes wayHappy trading
2014-06-08T20:13:50-0700,Ok since asked guess Ill firstSeems shame throw away cool info edit per rules thread time dont need pokemon since Benzo helped fill pokedex However may future meantime Ill keep monitoring thread pay forward
2014-06-09T16:11:06-0700,looking couple shiny Pokemon Pokemon well looking forShiny WantsShiny Toxic Boost ZangooseShiny Moxie PinsirShiny Inflitrator NoibatShiny Moody RemoraidPokedex WantsSlowbroMarowakHoppipSkiploomJumpluffSlowkingSteelixSlugmaMagcargoHoundoomLinooneSurskitCarvanhaSharpedoWailordGrumpigLunatoneBarboachCrawdauntShuppetChimechoWormadamVespiquenHonchkrowSkuntankHippowdonMantykeWeavileProbopassScraftyDuosionReuniclusAromatisseSlurpuffBarbaracleDragalgeHelioliskAmauraSliggooGoodraAvaluggNoivernHeres offerRare Shiny PokemonLucarioniteAggroniteAbsoliteLv34 Shiny GolduckSerious nature DampLv12 Fancy VivillonRash nature Compound EyesLv1 Shiny ZangooseNaive nature Immunity trade Shiny Toxic Boost ZangooseLv1 Shiny PinsirRash nature Mold Breaker trade Shiny Moxie PinsirLv30 Shiny RaikouCareful nature PressureLv20 French Shiny GiratinaNaive Nature Telepathy 6 IVsLv10 CelebiNaughty nature Natural Cure Pokemon BankLv54 MoltresLax nature PressureLv45 Shiny Lairon6 IVs Bashful nature Rock Head cured PokerusLv54 Shiny PelipperNaughty nature Keen EyePokemon IVsLv1 FletchlingAdamant Nature Big Pecks 3 IVs HP Defense SpDefLv1 FletchlingAdamant Nature Gale Wings 4 IVs HPAttack SpAtk SpeedLv1 FletchlingAdamant Nature Gale Wings 3 IVs HP SpDef SpeedLv1 German Cottonee Calm Nature Prankster 3IVs HP Sp Atk SpeedLv15 Japanese Mow RotomBold nature 2 IVs HP SpDefLv28 Hypno Serious nature Insomnia 2 IVs HP SpDefLv31 Forretress Bold nature Sturdy 3 IVs HP Attack DefenseLv1 German Fennekin Sassy nature Blaze 2 IVs HP DefenseLv1 French Ralts Modest Nature Trace 4 IV HP Defense SpAtk SpeedLv1 Elekid Adamant Nature Static 2 IV HP DefenseLv1 Rufflet2 IVs HP Speed Jolly nature Hustle nicknamed LincolnLv1 Japanese Charmander1 IV SpAtk Adamant nature BlazeLv25 Japanese Poliwhirl6 IVs Serious nature Water AbsorbLv32 Machamp2 IVs Attack SpDef Naughty GutsLv100 Greninja2 IVs SpDef Speed Serious ProteanLv37 Milotic2 IVsAttack Speed Bold Nature Marvel ScaleLv1 Riolu5 IVs HP Def SpAtk SpDef Speed Timid Nature Inner FocusLv1 French Tyrunt2 IVs SpAtk SpDef Mild Nature Strong JawLv44 Swoobat2 IVs HP SpDef Sassy Nature SimpleLv1 Zubat4 IVs HP Def SpAtk SpDef Naughty Nature Inner Focus Nicknamed GuandaLv1 Tirtouga6 IVs Relaxed Nature Solid RockRegular HavesLv1 TrapinchHardy nature arena trap various egg movesLv1 SquirtleLax nature Rain DishLv1 ZoruaLonely nature IllusionLv1 GastlyTimid nature Levitate various egg movesLv1 Charmander Rash nature BlazeLv1 Fennekin Lonely nature BlazeLv1 HonedgeMild nature Guard egg movesLv1 BulbasaurModest nature Overgrow Giga DrainLv1 CharmanderModest nature Blaze egg movesLv11 ChespinNaive nature OvergrowLv31 Magnezone Rash nature SturdyLv40 Omastar Gentle nature Swift SwimLv40 Armaldo Hasty nature Battle ArmorLv40 FerrothornBrave nature Iron BarbsLv1 Heat RotomModest NatureLv1 Fan Rotom Quiet NatureLv1 Omanyte Quiet Nature Shell ArmorLv1 Eevee Timid Nature AnticipationLv1 Pichu Jolly Nature DampLv1 Cyndaquil Quirky Nature Blaze Quick AttackLv1 SquirtleModest nature TorrentLv1 TreeckoHasty nature OvergrowLv1 EeveeQuirky nature Run AwayLv1 TreeckoTimid nature Unburden egg movesFC083424073465Pokemon InGame NameTrae
2014-06-11T15:54:16-0700,OkQUESTION another post question decide want offer pokemon trade aside pokemon wantsneeds Cuz point really wantsneeds future point may want get specific IV pokemon competitive team two dont mind trades help people event pokes shinys even 5 IV pokemon Anyways thats reasoning problem delete post Ill answer worries mate
2014-06-11T18:02:38-0700,hmmmmmm good questionfor time suppose second post suffice trade system Active posting bump ok double check tradingall posts made considered complete meaning post satisfied longer need op pursue trade thus edited reflect changesif like example want bump reflect completely new request mind personally since solid trade state systemI want people rely digging thread see people updated one post makes reasonso working site features seeing system created allow unless told wise still topic discussion implemented system trading multiple posts member long op editing reflect changes already requests offersI think however say maximum 3 posts per member thread flood thread much excessive bumping meaning op stay top posts try complete main objective bringing new wantsso let get info solutions done may able keep things current without much bumping notOne solution top mind put link sig post number thread edit op people need dig thread see trade postingsPost sig link page say post 2 keep currentbest atm sir Updated
2014-06-14T13:51:47-0700,Ok pokemon currently need Moon Stone evolve one pokemon used ones evolve different pokemon
2015-11-09T05:31:33-0800,Okay Hoopa Im willing tradeLooking Shiny Dialga named PrimalFriend Code2105 8928 9693Name game Omega Ruby Lomni X think Ronu Ill check Tradable
2015-11-09T06:44:42-0800,Hmmm Might interested trade Shiny back older game rename might challenge Give days see possible
2016-07-12T14:54:56-0700,Currently replaying Pokemon Yellow 3DS virtual console Need person trade Anyone San Diego area Pokemon RBY 3DS wanna trade
2015-11-20T14:19:22-0800,thread post Friend Code ORAS exchanging post FC Game Name hopefully one add youMine signature please add meYou find Friend Code 3DS top row bottom screen smileyface orange square profile inside pic
2015-12-02T16:22:16-0800,Hey guyslooking someone water friend safari frogadier please sure friend safari reply find code 177922667657Will add everyone
2016-06-02T11:13:04-0700,328253408078 IGN Marc Look forward adding
2016-06-03T18:50:27-0700,XY friend code thread quite codes also still accurate still work means please add sound good Hope thats helpfulEdit different games Ive used many different names real name Garret Ive also used PA Ken Bornin62 others depends felt like day started game may restart games time game name may change time sure matters much thought Id bring yeah stammering muttering rambling bored yet Get friend code registering guys
2015-12-10T10:41:37-0800,format scary sure one Im playing right
2014-12-15T18:43:43-0800,Good know Sucks Ill never able play official pokemon tournament though
2013-10-22T19:42:30-0700,3DS Friend Code Pokmon X Versions use WiFi instead code found game itselfFor would like post Friend Code would like anyone add gamesPost away would like addedMine siggy yad like add smile
2013-10-22T20:25:12-0700,might also useful post whats friend safari know want know stuff like xD
2013-10-22T23:20:49-0700,FC 439887456418 idea Friend Safari someone wants add find let know
2013-10-23T04:48:35-0700,FC sig already idea friend safari first place anyone refresh memoryCurrently 6 badges taking time since Im hurry Ive number trades online Ive good trade also using OPowers wellIf anyone interested trading passerbys Im named PA Canada game since underscore naming function game least saw
2013-10-23T08:27:00-0700,anyone Monsoon VivillonPM interested FC
2013-10-23T18:55:24-0700,Heres XY friend code 280985657688Ive defeated Elite Four help Friend Safari
2013-10-24T01:32:36-0700,Please add names BenFC 482844599339Already added Benzo Raen PA VivrelastacheIf anyone else adds please leave quick PM FC know add Beat Elite 4 working X
2013-10-24T20:05:15-0700,added given FC ThanxKeep um coming
2013-10-27T22:12:45-0700,Pokemon 451106812805Ice Snorunt Beartic CloysterI added
2013-10-28T05:27:10-0700,Fc 504323950723 Friend safari Loudred Teddiursa Chansey Ive added everyone list already
2013-10-30T13:31:52-0700,214883225451My Safari Meditite Pancham TyrogueAdded everyone
2013-10-30T14:45:47-0700,Ok Ive beaten elite 4 found friend safari However idea whats safari ones ever told yet hope good one guys However friends safaris way thank Stashe trading could get pokerus great safari normal pokemon Ditto Dunsparce LoudredI added everyone except one need pm code Remember guys good trade result using Opowers well Thanks againEDIT Hey bout Someone else name Garret
2013-10-31T06:09:01-0700,one Garrett another let know Sawk Mienfoo Tyrogue Safari
2013-10-31T08:53:59-0700,341110713848 know Lampent Pumpkaboo bought game third isnt available yet
2013-10-31T12:41:14-0700,Hey everyone FC sig DittoIm looking add people pokes needIncluding Ditto beldum scyther honedge giblegabitePM pokes need great onesPsREALLY need friend dittoFC 049058188262My safari includes Ditto 2 useless normalsLFScyther Beldum Honedge safaris
2013-11-01T13:44:46-0700,adding posted FCs added yet bit later today timeKeep um coming
2013-11-01T18:31:57-0700,Friend Code 094622367091 friend safari type rock Fill free add everyonePS terms Friend Safaris want Im really looking one Ditto right
2013-11-03T17:56:29-0800,added everyone aboveMy FC 405539833147My pokemon crabby frogadier wartortle
2013-11-03T22:16:50-0800,Heres FC459694873924 ChompyRickySafari Poison CascoonGarbodorDrapionWe Pokemon tournament like old times
2013-11-05T21:59:55-0800,Added everyone sure yet pokies havekeep codes coming
2013-11-05T23:58:33-0800,clue Safari gives either PM want exchange FCs
2013-11-06T03:34:56-0800,Benzo believe Sandslash Ninjask far cant see third yetedit yes starting really good friend codes
2013-11-07T15:39:37-0800,Westcoats FCPokemon X4811 7251 1712I clue safari type honestPM add add back Thanks
2013-11-07T21:45:44-0800,Added everyone except westcoatMaxed friend list Feel free add Azumarills also water monkey quagsire Updated Added everyone except westcoatMaxed friend list Feel free add Azumarills also water monkey quagsire 375464796774
2013-11-08T13:13:20-0800,maxed friend codes many registered 20 people far however might gotten around registering one reason another perhaps busy real life hope isnt case may recognize friend knows 3DS hasnt said anything able input yet
2013-11-08T14:15:04-0800,dont know max number friends everyone posted added ones repeat Pokemon know yet drop repeats SZ getting lame see two Pokemon 7 zones offer Pokemon well least 1 like 3 zones Nincada waste time getting 2 appear zones share 1 common Pokemon stand Pokemon Wartortal whole list zones Lame ask meI spent 15 minutes Wortortal even showed zones 3 display 3 PokemonWhats deal
2013-11-08T14:46:44-0800,Oh answer Ive never actually done yet reason since Im quite happy friend safaris However happen quite number repeat safaris want pare ones youd go follow easy steps Step 1 make sure mind profile want delete Step 2 friend code page touch Settings stylus Step 3 Touch Delete Friend Card Step 4 like says select friend card delete system says decide want delete longer friends person notification sent person asks ok say yes touching ok pressing button deletes person friend course doesnt mean cant add person later date
2013-11-09T00:00:54-0800,thanxI hope people understand get deleted personal thing
2013-11-09T11:54:19-0800,Friend Code limit 100 Ive hit deleted hit againTo open third slotThe person beaten E4 online play area time ie showlight PSS Friend ListAnd youre curious theres 195 Pokmon available Safaris Thats including 3 4 duplicates eg Mawile Steel Fairy Safaris
2013-11-09T13:46:56-0800,Thanks info change original FC implementation switching using 3DS FC instead boost numbers old systemThere spreadsheet works way add subtract people SZs fresh needswants
2013-11-09T18:50:57-0800,Well Im quite way away anywhere close limit thats really case wont worrying quite timeSpreadsheet Bring Whats aboutposted 3DS
2013-11-09T19:40:42-0800,Gym Mobile Version shweet Give tryYes spreadsheet worksposted via EtchAScetch
2013-11-11T15:31:39-0800,HelloI added everyone given FC add tooMy FC 066235644148I clue safari lol hope helps xD
2013-11-11T17:57:34-0800,added EVERYONE code 425341658912I give Chansy Dunsparce Kelkeon
2013-11-11T18:22:39-0800,Ive added everyone please feel free add meLyike3394 3877 9820
2013-11-11T21:52:45-0800,FC 3909 7514 7164Friend Safari Gabite Shellgon DrudigonReally looking Ditto friend safariAdded everyone Ill try stay active let register
2013-11-13T10:38:04-0800,1418 8154 3496 homeofmewin process adding everyone think fighting
2013-11-14T22:13:26-0800,kk added everyone listed farDont forget add added keep codes coming inspreadsheet soon
2013-11-16T13:06:26-0800,friend code 128989177447 dont know friend safari type
2013-11-16T15:38:55-0800,Safari Ghost Phantump Lampent Spiritomb
2013-11-17T12:15:58-0800,please add finding ditto longFC 061939427035mine one poison type Toxicroak Kakuna Garbodorjust added thanks add back
2013-11-17T17:02:42-0800,part Id like thank added friend number pokemon due generosity appreciate greatly dont know friend safari change start use Pokemon hope maybe helped small way case thanks againIve added everyone point
2013-11-17T18:11:21-0800,think calls Pokemon Online Tournament
2013-11-20T19:54:07-0800,great Ive added everyone point sent PMs youReally appreciate adding friend codeAnd would someone PLEASE let know ThanksKenFC 336814516888
2013-11-22T11:11:43-0800,anyone Fletchinder friend safari
2013-11-22T18:36:34-0800,Im dittoing someone else one safaris Whatcha looking one specific one Oh thanks Emolga looking whileYours may still lots roomDont get wrong cant get start game pretty much looking specific one could also breed one
2013-11-22T18:40:17-0800,SZ provides Pokmon 2 perfect 31 IVs Pokmons Base stats better option get Pokmon 2 31s vs trying catch wildMakes breeding much easier
2013-11-22T18:54:38-0800,Yeah Ive told whats easy way see ones actually 2 perfect IVs particular species know one person looking max IVs Dittos Fletchinders SZ pokemon way odds stacked favor finding perfect IVs
2013-11-22T19:02:49-0800,Kiloude City Pokcenter man left tell 2 IVs 31 Pokmon obtained SZ guy even tell Pokmon really low IV stat really low even zeroThe odds stacked getting 2 perfect IVs SZ Pokmon Getting right Nature SZ Pokmon find oddsEditSince Ditto breeding king compatibility getting Dittos 2 31 IVs lucky 2 guaranteed 2 31s definitely current must SZ Pokmon choice competitive scene
2013-11-22T19:17:34-0800,Yeah understand Ok well get full box Ditto Ill check Im half way thereWhile Im Im also propagating pokerus pokemon party giving caught dittos well dont catch right away put storage since dont time keep Ill getting lot time weekend upEdit Ok DELwhen guy says stat cant beat pretty much say maxed rightDELEDIT2 later figured wasnt case expression says end speech still yet find good guide meansIf moment 40 Dittos 27 pokerus large number least 2 maxed IVs one maxed 3 4 maxed stats hours harvesting Dittos think didnt turn badFor mods apologize taking subject topic case Im willing trade registered FC Im looking anything special Im favor youd like trade good pokemon certainly wont object thats goal Preference given pm trade request time Im online game dont mind trading start later today well past bedtime Im
2013-11-22T22:39:18-0800,PAThe 2 31 Ivs useful breeding ability get male female versions pass 4 31 IVs Also FS fletchinders hidden ability gives flying moves 1 priorityIts useful bird team
2013-11-24T09:02:21-0800,Looking find whats friend safari also looking someone Dittos theres want start IVEV TrainingMy FC 006110068032Edit Forgot mention added everyone
2013-11-24T10:25:54-0800,Karlos Skarmory Magneton dont Ditto FS Ive harvested bunch given pokerus Find online today Ill trade one help
2013-11-24T10:27:11-0800,Im steel Thats cool Thank Wont ever say Pokerus
2013-11-24T11:38:15-0800,PA dont worry far topic since thread SZ topic info helpfull understanding point usefulness SZ info supports want obtain FCs cause contributing game communityI added everyone register 38 FCs 18 active 7 FCs hereStill looking add
2013-11-24T11:52:08-0800,Well Glad service LOLKeep friend codes coming guysEdit Karlos interested particular nature maxed stat 40 available
2013-11-24T12:10:07-0800,40 would amazing thank mostly keeping himher boxed using PokerusEdit Thank Thank Thank Pokerus Ditto definitely come handy
2013-11-24T12:31:35-0800,pleasure traded Klefki also shown FS
2013-11-25T03:29:53-0800,Ah yes thanks also made stats comparison spreadsheet excel help time consuming done able clearly see pokemon stats measured Ill bookmark page help well
2013-11-26T06:30:55-0800,New info son Josh starting friend codes game may read gym much willing hes willing FC people well updated game FCs youd like add code530096850389As far tell FS Ground Camerupt Trapinch Weird sure 3rd one yet EDIT Diggersby 3rd
2013-11-26T16:47:36-0800,may seem stupid lot aquaintances dont know type friend codes anything Could someone help
2013-11-26T17:55:58-0800,use friend code 3DS face top 3DSs main menu click view 3DS friend code input friends code
2013-11-26T21:25:25-0800,Nope stupid everyones gotta start somewhere rightFirst Vaporeon suggesting need make mii Essentially thats character representation essentially avatar use represent online make using Mii Maker software Home screen comes turn 3DS made representation poor one case without using picture software reasonably close figure Ive told home screen top theres smiley face opened shows friend code code linked 3DS WHATEVER GAME HAPPEN PLAYING GAME SLOT choose allow people see game playing favorite game last online entirely choose allow others see parental note coming next might worthwhile note younger players give much info friend code certainly give code others even arent friends like thread aware info public decide make soOne thing note happen give friend code everyone benefits able go friend safari even though personally cant go get added benefit able trade players community ability using receiving OPowers well definitely winwin situation respectHow register codes Thats easy youve finished getting code reopen smiley face notice top touch screen says Register Friend Click put 12 digit friend codes people want add names noted earlier thread input quite codes 3DS full register away youve done might wise let person know youve friended game register FC Thats need Every open friend code app see whos online see lighter colored person Player Search System screen normally touch screen youre battle friend happen registered able see Friends section instead Acquaintances Passersby sections times interact friends clicking lighted avatar unless busy either trading battle happens lot dont discouraged dont get trade first time see avatar lighted Dont worry time second natureGood luck hope see lot friend codes threadEdit One thing neglected mention dont know exact name person plan friend dont need worry input think name might like whatever decide call someone example Benzos name game also Benzo personal name Garret game name PA 2 codes linked friends 3DS system let know person registered point youll know person registered name sweat
2013-11-26T22:14:28-0800,Didnt realize friends 3ds thing rather individual game Thanks depth description P post code tomorrow get home
2013-11-28T04:48:16-0800,Friend code 3754 7063 4638Editi also added everyone threadI also sure safari
2013-11-28T17:22:29-0800,Mitch electric Luxio Dedenne Stunfisk
2013-11-28T20:39:49-0800,FC 373799767722My Safari Normal Lillipup Chansey AudinoIve added everyone thread
2013-11-30T14:29:36-0800,FC 077455289713Dont know give added people look forward expanding safari
2013-11-30T19:43:46-0800,Chris far youre water supply Floatzel Octillery idea 3rd one yet
2013-12-04T05:25:53-0800,son code236370500938 Mine Bug100591180134 Sons PoisonI add peoples codes tonight
2013-12-04T14:06:49-0800,great thread Im adding everyoneMy friend code 216557503089I rock type safari believe
2013-12-04T16:07:27-0800,Hey great good see hereDEL nice want add amount codes available might wise make sure permission fact might better give codes sure since may want information publicDEL EDIT ARGH cant believe took post wrong accident Sorry least figured afterward needed put everyones codes later tonight feel kinda sillyredfaceYes amazing thread showing great community spirit Im looking forward seeing lot people codes Welcome everyone
2013-12-04T18:41:18-0800,far great turn codes indeed Keep comingI think safe assume people posting FCs unless specifically stating give FC via PM open permission add
2014-01-20T05:39:22-0800,Hi everyoneI wondering friends two pokemon safari dont think havent beaten elite four friends people able see third pokemon little research online saw friend online time seems like tedious easier way get access third pokemon
2014-01-24T21:55:18-0800,way activate the3rd slot need online time playing game
2014-01-25T16:04:02-0800,doesnt seem necessarily hold true locally added friends added someone IRL yesterday immediately Ponyta availableDefinitely true online however
2014-01-26T14:20:30-0800,Thank clarification reply included local adding general indeed immediate
2014-01-27T09:35:32-0800,kinda knew post asking easy way get friend online time Sorry post clear
2014-01-28T13:29:40-0800,Actually seems wrong added friends elsewhere online time according 3DS friends list game wasnt later go turn Pokemon one guys online game appears friends section PSS got 3rd pokemon friend safari guys online time online game Turns need online int actual game get 3rd friend safari pokemon game broken tell done persons PSS avatar appears friend safari list vouch rivershock say locally added friends maybe exceptionUnfortunately still dont know contents friend safari Local added friends havent completed main game yet cant find form themIll post FC hopes 1 someone adds online time 2 notify contents safari edit post add inFC 053356370926PM add well sort time online time full contents safari seen
2014-04-05T19:56:08-0700,Pokemon X Friend Code Exchange DHey fiance want exchange friend codes lots people numbers Fox FC 240653371984 bug safari dont know Pokemon Neko FC 279309172272 dark safari Sandile Nuzleaf last one unknown
2014-04-06T04:56:54-0700,Definitely Mine Alexander 5112 3578 3700 Ghost Phantump Lampent Golurk
2014-04-06T06:50:27-0700,Thanks swift response find whats safari could let know please
2014-04-06T11:10:09-0700,Looking exchange FC DFox FC 240653371984 Bug Butterfree Illumise VivillionNeko FC 279309172272 Dark Sandile Nuzleaf yet beat E4Were willing add anybody
2014-04-07T21:30:03-0700,anyone friend safari Liepard please pm trade really need one lol
2014-04-10T08:43:09-0700,Add everyone idea safari beat game final fourI would love find sableye safari ditto safari safaris good far Im concernedMy friend code 401254023238 game name Alex
2014-04-12T08:07:21-0700,Added everyone far including friend code thread Please add havent already done
2014-04-13T18:01:42-0700,Feel free add always looking new people play withFC 491434521470 AdamGyarados Octillary Azumarill Updated Feel free add always looking new people play withFC 491434521470 AdamGyarados Octillary Azumarill
2014-06-09T16:13:56-0700,FC 083424073465 Game Name TraeIm sure type Friend Safari looking forward battles trades well Updated FC 083424073465 Game Name TraeIm sure type Friend Safari looking forward battles trades well
2014-11-15T15:15:24-0800,anyone wants add feel free clue FS isJade165014445328
2014-11-15T17:26:10-0800,Thanks Jade went straight friend safari found psychic pokemon far rather spunky little Espurr Munna Wed online time find 3rd one wish Id known FS earlier looking good EspurrEdit wonder friend safari pokemon different ORAS even friend safari game Guess well see Friday
2014-01-04T14:00:07-0800,highly confused read reread triple read rules find says may Megaevolve one 1 Pokemon per battleAny link new set rules change change made aware ofeditAnswer provided game mechanics restricting
2009-09-28T19:00:46-0700,Note Discussion stop identify hacks allowed
2009-12-05T08:39:10-0800,PokeGym takes ZERO tolerance stand Hacking ROMS illegal activity regarding electronic audio visual medias electronics applications movies games music etc protected US Federal International Copyright Piracy lawsFor reasons PokeGym Staff willing open site possible legal actions allowing said discussionsI dont think make clearer
2019-12-12T21:56:22-0800,Play Pokmon Video Game Rules Formats Penalty Guidelines revised 4 December 2019 effective 4 January 2020
2017-11-20T10:13:05-0800,need x6 lucky eggs started game nothing offer offer packs ptcgo anyone wants lolAny help would appreciated
2016-12-26T20:12:44-0800,Woah seriously quite bit easier get shinys SunMoon Ive already caught 2 wasnt even looking trying Found geodude metapod random searches grass havent even tried breed pokemon either yet ones found
2016-12-29T13:10:29-0800,heard harder get shiny Pokemon SunMoon still havent found yet spend lot time grinding Pokemon exp Ive never lucky kind things
2016-12-31T07:11:37-0800,Well thats odd nice usually pretty hard time finding trading Ill starting Moon tonight since Im fairly happy point Im Sun Hopefully Ill luck game start transferring pokemon Bank Ill quite shinies one spot many Id like course still
2016-11-14T14:48:48-0800,pick copies Anyone else getting copies early
2016-11-21T14:33:12-0800,Apparently quite Barrie close 200
