date,comment
2012-11-29T11:23:35-0800,SpearowFearow Sniper Windswept Sky Fearow actually cool Poke introduction Drill Run Keen Eye one worst abilities ever Sniper major improvementSandshrewSandslash Sand Rush Icy Cave Sand rush makes Sandslash mildly usable offesnive Pokemon something previously never able better somethign else Still outclassed Excadrill better beenDoduoDodrio Tangled Feet Pleasent Forest None abilities great Tangled Feet lets use Choice Banded Thrash 120 BP without ever becoming confused makes use decent attack good speedKrabbyKingler Sheer Force Sparkling SeaHidden Grotto abilities dont really help Sheer Force amazing ability suited Pokemon better nothingTyrogueHitmonlee Vital SpiritUnburden Rugged Mountain best Tyrogue Unburden alongside Normal Gem Fake make Hitmonlee dangerously fast powerful sweeperSmoochumJynx HydrationDry Skin Spooky Manor Giving Jynx immunity Water easily give free turn use Lovely Kiss Substitute Nasty Plot go ont offensive constant healing Rain also quite niceTaurous Sheer Force Pleasent Forest Sheer Force really good Every Pokemon appreciates itNatuXatu Magic Bounce Pleasent Forest Magic Bounce reason use Xatu number fo moves makes completely useless staggeringWooperQuagsire Unburden Sparkling Sea make Quagsire excellent wall Curse RecoverMurkrowHonchkrow PranksterMoxie Windswept SkyHidden Grotto abilities perfectly compliment Pokemon better ability access toGligarGliscor ImmunityPoison Heal Windswept SkyHidden Grotto Pokemon get abilities allow function best meant doQwilfish Intimidate Skarling Sea Makes better use decent typing wall fighting types fire types long enough set hazardsHERACROSS Moxie Hidden GrottoDream Park Heracross MoxieCross probably MoxieCrossSwinubPiloswineMamoswine Thick Fat Icy Cave extra resistance cancelation weakness Mamos handful usable moves still available good pass upGirafarigStantlerMiltank Sap Sipper Pleasent Forest None Pokemon mind Sap Sipper use decently clear cut ability eitherPoochyenaMightyenna RattledMoxie Pleasent Forest Poochyenna doesnt really care ability Mightyenna start function halfway decent Pokemon Sucker PunchCrunch Moxie arsenalWingullPelipper Rain Dish Windswept Sky Keen Eye bad Rain Dish ok Keen Eye really really badGallade Justified Spooky ManorNimbasa City BLW2 get Ralts get Ralts ability worse usual ones Justified however gives Gallade way raise attack usually better SteadfastShroomishBREELOOM Quick FeetTechnician Dream ParkHidden Grotto Quick Feet cute alright TechLoom monster Mach PunchLow SweepBullet SeedSpore Stone Edge thats youll ever needSableye Prankster Spooky ManorNimbasa BW2 Sableye rediculous number options go alongside Prankster easily shut physically offesnive set PokemonVolbeatIllumise Prankster Spooky Manor Really Volbeats blessing Tail GlowBaton pass Illumise doesnt much else going itCarvanhaSharpedo Speed Boost Sparkling Sea Gotta go fastSpinda Contrary Rugged MountainNimbasa BW2 Super Power Contrary Spinda fun usable anything else could ever doCacneaCacturne Water Absorb Rugged Mountain arent using Sand playign metagame Sand Veil banned best ability itSwabluAltaria Cloud Nine Windswept SkyHidden Grotto equally good ability Natural Cure Shutting weather better doubles Nautral Cure better singles worth notingZangoose Toxic Boost Hidden GrottoDream Park signature dream world ability pretty cool works better Zangoose Immunity every way notBarboachWishcash Hydration Sparkling Sea used thign competitve battling one took seriously swept teams 60 guy RestDDEarthwuakeWaterfall rain much damage isnt even funny something gratifying using Wishcash beat someoneCorpishCrawdaunt Adaptability Sparkling Sea Crawdaunt Adaptability Poke two typings making dangerous already Add Dragon Dance amazingly proficeiant sweeper got Aqua Jet LileepCradily Storm Drain Sparkling Sea Lots sea critters great DW abilities Storm Drain turns neuatral hit healing immunity allows Cradily set Stockpiles easierAnorithArmaldo Swift Swim Sparkling Sea Seriously much Sparklign sea row oo Swift Swim decent pokes arent good Pokemon inof themselvesTropius Harvest Windswept Sky Worse Eggs using better nonHarvest TropiusFroslass Cursed Body Icy Cave Im touching Pokemon Moody broken ability banned every metagame ill ever play ignore Snowrunt Cursed Body cna allow Pokemon set Spikes Destiny Bonds easierBagonShelgonSALAMENCE Sheer ForceOvercoatMoxie Rugged MountainHidden Grotto Moxiemence big claim fame others dont hate abilities either seriously Moxiemence Moxie one abiltiies blesses every Pokemon touches Salamence peak Moxie MountainStaraviaStaraptor Reckless Windswept Sky Added damage two best STAB moves make even dangerous PokemonShinxLuxioLuxray Guts Pleasent Forest Awful Pokemon reallyonly two sets could ever hope use Guts one fo themMothim Tinted Lens Pokemon Cafe ForestRugged Mountain Bad Pokemon prevos dont want DW abilities one slightly better SwarmCombeeVespiquen HustleUnerve Hidden GrottoDream Park Bad Pokemon enjoy DW ability Vespiquens regular ability isnt unusable though sets prefer Pressure shutting Lum Berry helps Toxic Stall doesPachirisu Volt Absorb Pleasent ForestHidden Grotto abilities literally nothing anythign improvementBuizelFloatzel Water Veil Sparkling Sea run either ability SwitcherroFlame OrbWater Veil cool niche Pokemon hasDrifloonDrifblim Flare Boost Windwept Sky Getting half Zangooses ability Pokemon 3 abilities useful vary different rolesGibleGabiteGarchomp Rough Skin Icy Cave sure Gible would hang near Ice Rough Skin decent ability especially playign Sand Veil bannedHerdierStoutland Scrappy Hidden Grotto Sand Rush usually better arent using Sand able nail Ghosts STAB Return frees needing Crunch makes Choiced Sets betterPurrloinLiepard Prankster Hidden Grotto SwaggerSubFoul Play fun set Pokemon really dislikes Prankster ability one better users itPidoveTranquilUnfezant Rivalry Windswept Sky None abilities good usable optionBlitzleZebstrika Sap Sipper Hidden Grotto abilities immunity abilities tailor whatever want Nice cant Spored supposeWoobatSwoobat Simple Hidden Grotto Awww yeah Simple Calm Mind days Great abilityTympolePalpitoadSiesmetoad Water Absorb Pleasent Forest Immunity abilities common types good quite standard WaterGround types works better abilities casesMaractus Storm Drain Rugged Mountain Better Water Asborb even though thingTrubbishGarbodor Aftermath Hidden Grotto useful cases sets hazardsMincinnoCINCCINO Skill Link Hidden Grotto Yes accounts way use Pokemon packs punch Three different moves hit 5 times guaranteed providing decent coverage non Steel types Wake Slap Uturn good 4th moves thatDucklettSwanna Hydration Windswept Sky Better thant two abilities Swanna really wants Rain support dual STABsEmolga Motor Drive Windswept Sky Emolga frail anything lets take hit goodFoongusAMOONGUS Regenerator Hidden Grotto Big big winner Regenerator Amoongus replaces Amoongus even outclasses replaces use Regenerator dont use PeriodAlomomola Regenerator Sparkling Sea good Regenerator Amoongus bad additionKlangKlinklang Clear Body Icy Cave Plus Minus horrible even doubles since KK likes physical attacks better ability use bad PokemonElegymBeheeym Analytic Spooky Manor Slow Pokemon anyway Synchornise alright usualy Analytic superiorCubchooBeartic RattledSwift Swim Hidden Grotto Snow Cloak bad sometimes banned abilities make sense though neither good PokemonGolletGolurk Guard Spooky Manor Usable though tend lean towards Iron FistAlso Dugtrio Sand Force absolutely horrible never run ability isnt Arena Trap Ever Arena Trap makes good id hope gets removedI dont know including EventPromotional DW Abiltiies since arent easy access dont know releases America Blazekin Infernape Gothitelle Venusaur Charizard Blastoise Torterra elemental Monkeys would garner attention list
2012-11-29T12:55:07-0800,love Icy Cave pls SneaselWeavile Pickpocket Definitely better Pressure speed Pokmon useful Focus SashVanilliteVanillishVanilluxe Weak Armor useful faster second hit Ice Body makes sense HailAxewHaxorus Unnerve See EkansArbok useful abilities
2012-11-29T16:32:40-0800,wish Weavile holding NOTHING Pickpocket work Use berry want Focus Sash isnt going work
2012-11-29T23:06:24-0800,Also Haxorus never using Unerve useful Mold Breaker getting around Levitiate Sturdy
2012-11-30T10:06:45-0800,Lightningrod Seaking amazing Rids electric weakness boost SpAtk
2012-11-30T15:49:55-0800,funny fish hoping zapped swimming around water
2012-11-30T22:51:15-0800,Harvest chance activate every turn kinda like Shed Skin like
2012-12-01T02:07:34-0800,Pokeradar provides DW Female Pokemon wellLegendary Pokemon includededit time list Pokemon found Dream Radar sorry weak contribution discussion
2012-12-04T10:29:35-0800,mods want help format remaining text original post guest ton may get around moment
2012-12-04T14:14:45-0800,problem assist getting cleaned also chance provide Dream Radar Pokemon info welledit Dream Radar Pokemon listStaryu analyticPorygon analyticIgglybuff Friend GuardTogepi Super LuckShuckle contrarySmoochum hydrationRalts telepathySwablu cloud nineDrifloon flare boostBronzor heavy metalSpiritomb infiltratorRiolu pranksterRotom levitateMunna telepathySigiliph tinted lensTornadus RegeneratorThundorus volt obsorbLandorus intimidateLugia multiscaleHoOh regeneratorDialga telepathyPalkia telepathyGiratina telepathyBeldum light metalSlowpoke regeneratorHoothoot tinted lensThis list added main post main post cleaned rest information abilities edited time
2012-11-27T17:13:34-0800,Hey got idea thread reading recent editorial post pokebeach Ive actually thinking along lines Well perhaps pokemon seemed rush generation door honest Im sure mind overly cute pokemon last batch opinion Yes like latest set games Black White 2 fact opinion best pokemon games produced far However opinion things missing would really set games Use new 3DS system would make great changes brand bringing ability streamline online playability Thatll certainly help kinds changes would like see games themselvesIn copy Black 2 Ive already put almost 200 hours remember playing 900 hours Sapphire yet Im certainly done fooling around Im sure many even put way hours Ive went pokemon league thats unusual since games Ive went least 50 times per game Ive got 1 pokemon level 100 3 90s normally quite Ive completed Unova dex though havent caught yet However Im far away think need 70 give take Theres lot see gameyet theres still something missing Id like opportunity see cross species breeding would produce imagine cool combos could produced Currently along 28 Unowns total 676 different pokemon right Sure species pokemon dont breed would leave enough variety new generation games perhaps even current full size game consoles could handle Even limit breeding within egg groups variety would enough satisfy anyones interest new pokemon new abilities stats interesting cool new looks Id certainly hard time putting hey consider Spinda maybe even varieties looks within varieties Personally think would coolSo agree Would like see type game would like see new generation pokemon games
2012-11-27T17:23:57-0800,like idea cross breeding looks get degree game design plan making Pokemon game breeding system going allow breed abilities attacks stat rank well bunch cool stuff legendaries going breedable well Articunos learn Thunderbolt breading generation Pokemon like ZapdosIt lot work fun training
2012-11-27T18:12:41-0800,Personaly id like storyline makes sense main character become part conflict biggest problems evil teams create isnt repition increasingly crazy dedication members designs motives Team Aqua get blatant events happening around character NPCs force intoLooking Pokemon Gold Silver instance imagine much sense would make play Silver dad rocket boss wouldnt need anything diary small speech wanting live fathers shadow gym challenge would arbitrary usual least interaction Team Rocket would make senseOr Pokemon Black White 2 playing N determined right wrongs brought defeat new wave Team Plasma stand selfish desires already shows big boss fight anyway crying loudI feel BW2 certainly introduced welcome changes starting big city new locations Pokedex feature feels like really perfecting mechanics want see story arch game work bit main characters hard time forcing newest games time everything grinding fetch quests brings tot second thing id reaaaaally liek seeAdventure game style mini games Theyve tried gimmicky minor plot battle systems like PokeWood Musicals Frontier Battle Tower Contests none really stuck want see areas enter things get bit control Like instance Bug Catching contest get first person view scramble get best Pokemon racing contestants Like mix Pokeatholon Bug Catching contest ideas perspective change mix things make use HM moves interactive actually letting surf fly hack away treesNow obviously may bit much ask DS even 3DS comes would really thing make title titles want game main series game available played WiiU WiiU pad 3DS Pokemon one biggest sellers Nintendo time really pushed new title systems Mario horribely abused consol transitions almost alwasy beign remakes though Paper Mario 2 looks cool think increased power system needs put use may much ask one game accesed different platforms savingsbundle package allows play 3DS version WiiU version leastThe WiiPad makes lot sense lower screen DS Pokemon games allow keep charm increasing graphics making usability something simple Bag pretty cool also lot potential reshaping way battles preformed still recognie thata full WiiU version alienate long time fans portable version takes away convience way another game want ont WiiU work would take think could get away maing new story exsisting regionsAnd ofcourse want Pokemon Snap 2 WiiU makes much sense fact could include ti main series game give character Camera would soooooo cool darnit
2012-11-27T18:31:51-0800,Ah good Im one whos thought Im sure long time players like Vaporeon might even tide us especially play game competitvely well Id like go gusto also breed new odd looks new cross breeds well dont think Id ever get tired checking new formes though given chance Anyone else ideas theyd like see future new generation gamesEdit Shino youve got great ideas Actually work hacking away trees Racing contestants pokemon snap yeah definitely Maybe even show levels attacks like much powerful attack pokemon level 50 level 10
2012-11-27T21:28:48-0800,problem crossbreeding gets way hand fast Take Field egg group example Im counting right 90 Pokemon lines group Ditto makes 91 line effect Pokemon instance breeding Spoink gives pearl head would 4000 combinations lines possible would custom front back sprite fully animated member evolutionary lineAnd oh yeah cant forget shininess every one 4000 combinations TWO sets sprites one normal one shinyBut wait gender differences gender variants would need FOUR sets sprites Male normal male shiny female normal female shinyAnd thats one egg groupIts since took Statistics class wont go though effort calculating everything Suffice say entire cartridge would stuffed full sprites would room yknow game saying wouldnt fun see logistically nightmare Maybe Gen 1 would possible many Pokemon theres way
2012-11-28T05:01:07-0800,Yes Im sure logistically might challenging understand 3DS still working cartridges right Whats stop making larger cartridge Whats current memory storage one carts anyway certainly dont idea maybe time memory capabilities get better anyway cross breeding would showcase best possible use opinionIf something like attempted think could even marketed pokemon breeders game dumb plot bit concentrating upon cross breeding aspect even future games next generation one dont memory keep sprites someone port pokemon didnt currently sprite memory couldnt game receive sprite data pokemon transferred new game matter cant game made sprite data made occasion production pokemon based original raw data current 676 breaking sections gen 1 pokemon crossbreeding gen 2 another game gen 3 another etc Breaking would bring even money pokemon creators since many us wanna ketchum Im sure ways get around objections little ingenuity active imagination would takes Oh years worth manhours programming well lol
2012-11-28T05:32:38-0800,PAMy idea iis make Pokemon game way raised grew take favorite monster train best push past limit become part lives put trust place trust back true partnership many events game reflect thatI planning giving attacks level level 10 surf lot better level 1 surf pokemon would gain AP would spend upgrading attacks abilities also plain way level system far restrictive place system Pokemon stat cap way players train use favorite Pokemon Every Pokemon give EVs AP place experience points get lot EVs like 5000 battle spend increase stats Youll go menu use points put required amount EV stat stat increase 1 point x depending Pokemons stat rankAs breeding side things Physical changes would hard design team Im sure color changes could put Like Vaporeon white ear fins yellow ones plan make every pokemon breed able give every pokemon gender differences male female form Zapdos lot planned game
2012-11-28T09:51:55-0800,Yeah thats another point like Currently games somewhat restrictive buy Sure shops BW2 allow buy attacks bringing number bluegreenredyellow shards corelation good playerbreedercollector everything lucky happen upon right shard lying around ability show good earning right receive certain attacks abilities would cool Good idea Vaporeon also like unlimited stat idea would definitely showcase talentAnother thing showcased another game berries Maybe Im bit farmer heart dont know perhaps thats breeding thing seemed hit would like idea growing producing berries well available ones showcase talent growing right mulch take care plants well better pokemon could get better crop berries perhaps multiple berries time maybe potent berries added effects could result better sim game many options current generation
2012-11-28T10:05:51-0800,Oh another thing game offer game services players buy items online store likely nintendo e shop Players make items poke balls ect put online store players need buy item go games online store like GTS items players put sell buy items also unique Im going make finish making item get rank good better rank effective item longer last use like battle items break higher rank longer lastThe thing also apply berries breed custom effect growing process done sell players use
2012-11-28T11:40:58-0800,OOOooo great ideas Right like Gives reason utilize online content showcases abilities wellHey ability import music 3DS slot micro SD card right able access music put card youre using game think would sooo cool Rockin tunes would much preferred boring pokemon music Hey dont get wrong pokemon music cool SMALL DOSES kinda wears ya Everyone style may coincide supplied music Personally shut speakers playing pokemon currentlyEdit One suggestion could also make game bit realistic showing long takes make particular attack Like Quick Attack Extreme Speed would almost instantaneous whereas maybe takes 5 seconds surf time takes build big wave make attacks land land instead turn based enough time get another shot opponents pokemon faint take shot second attack Sometimes may even get 3 4 shots pokemon able get one attack option turn turn based attacking would great Sometimes youd like crush pokemon fast sometimes speed pokemon might slower might want reinstate turn based play thought
2012-11-28T12:59:40-0800,Well game would maid Wii U future system online option play missions friends Im sure allowing use music game hard xbox 360 games allow itAs battle system taking away turn base system replacing free roam system players control Pokemon battle jump run walk dash block fly fly etc want way game focus much speed game focus stats wont dependent like DS games force players play using favorite Pokemon like game use wins highest statsI also going change stat buffers work well boost stat effect stay play 20 seconds go away Status effects like sleep go away Pokemon hit nothing game based turns time battle system really want get done plan game way Pokemon beIf also possible want release 2 versions game E rated version rated version players age group appreciate
2012-11-28T13:58:25-0800,wish knew program games could help type projectYeah considering pokemon geared primarily towards young people perhaps teen version would cool difficulty envisioning coming pass doubt pokemon would ever allow franchise get teen rating However opinion little consequence Im sure sell whatever sells well demand high times pokemon change
2012-11-28T18:04:32-0800,love ideas guys putting would definitively play gameBut Im sure like idea online store playersLike siblings allowed use online options Dream World GTSWith Dream World GTS easy ignore big impact game item online store suggesting would make lot harder ignore online featuresJust thought
2012-11-28T18:43:16-0800,Well would online store DLC becoming popular options games allow add new regions missions cool stuff plus would allow players sell game items make players players dont cant make themI understand everyone use internet cant remove people cant use realize online features take away basic game play
2012-11-28T18:55:18-0800,Since youve mentioned want game designer Id like highlight statement youve made briefly disturbs another hopeful game designerX popular good reason something fact one worst possible reasons something taken alone marketing seems common campaigns structured around idea popular without really paying attention campaigns fail important really examine gain something implementing Something popular give idea doesnt mean itIn case online store Pokemon makes little sense would sell make sell would better already get Pokemart Game Freak seems know exactly much want work get items see Battle Frontier could make kind online store make getting TMs EV items like dont know would put would unique useful without somehow breaking game anyone couldnt didnt want use storeThere big difference downloadablelike regions missions Pokemon like online store contains items player might want need proceed ever played mockfree MMO like Grand Fantasia Runescape something like Technically game free play becomes obnoxiously difficult play without paying membership service feel like arent getting real experience without paying Even players pay nice outfits cool cosmetic weapons features actually put players really like game free experience whatever ad revenue hard cartridge sales would get anyway always frustrating see people running around awesome outfitswingspetsskinsetc couldnt get wasnt willing pay know way earn gameplayThis also kind faulty point view Technically speaking youre right ADDING online feature doesnt detract whats already hard copy game especially competitivecommunity game like Pokemon really lose miss online features dont opportunity attend Nintendo giveaways trade people cant complete Pokedex matter hard try example always Pokemon people get cant obnoxious feeling player drive away gameAs developer decide interested faction cant use content youre making Maybe dont care much thats fine trying say wont take away basic game shouldnt complain strikes failure acknowledge way audience actually reacts game content
2012-11-28T19:01:56-0800,sort like idea game team work stratagy based need switch another Pokemon get attack take Boss PokemonExampleParty PokemonCharizardPidgeotScytherNidokingPikachuSandslashBossKyogreYou travel around like First person shooter game carrying 5 Pokemon one stays follows need travel various areas game go tunnles caves hills ect visit towns goal game would go capture Legendary PokemonYou restricted 6 Pokemon youll need trade Pokemon people game order go areas game Like want go hills need trade Pokemon 1 10 choice Pokemon take along navigate area Pokemon level battle normalYou able catch wild Pokemon Part stratagy plan ahead make team go take legend Boss PokemonYoull fight say Kyogre lake plains area Groudon cave ectThe battle mechanics way different need utilize 6 battle BossYou approach Boss Pokemon come need place Pokemon strategic manner around Boss coop attacks get specific attack actually bring Boss Pokemons healthExample battleSaid team take KyogreUse Charizard pick Pikachu land Pikachu onto ledge able use Thunderbolt targeted Kyogre get hit needed reduce hit points KyogreMeanwhile Kyogre attacking place say water gun hitting Pokemon reducing thier hit points KO teamSandslash digging holes lower water level Kyogre move around alot less making easier Pikachu target Thunder bolt Kyogres weak spot belly need Nidoking aproach Kyogre give Tail slam get Kyogre flip expose week spotThe way switch different Pokemon battle like control teleport first person view eyes Pokemon go switch order control move Pokemon task like actually fly Charizard pick Pikachu Switch another Pokemon task Draining water immobilize KyogreKyogre wont simple push either like Surf flood area Rain dance raise water level back Ice beam build wall ice block attacksThis game idea loooooooooooonnnnnngggggg time think would awesome battle style like KO Boss get catch transfer DS gameAnyways hope said made sence would take good amount stratagy planning choosing right Pokemon need level little go fight next tougher Bossmeh dream game
2012-11-28T19:18:22-0800,Id happy included halfway decent story finally ditched 2x2 square grids Im simple guy way
2012-11-28T19:54:15-0800,KayleWell care everyone plays game every access games features use wont take away main story game items would DLC dont know yet Still working details BulladosThe story great Youll playing trainer got accepted Pokemon Guardian Force military force Collecting Gym badges E4 optional restricted square grids
2012-11-24T11:13:22-0800,Woo Whoo Female Scraggy Obtained one last night
2012-11-24T13:15:22-0800,Awesome slowly building Dream World home Dream World abilities really fun collect
