date,comment
2013-05-13T21:09:03-0700,ThanksI dont really battle Pokemon except trainers game
2013-04-21T19:33:20-0700,confirmed true prance around like fairyIf contest stuff supposed dress pokemon going dress fairy type hockey gear call RockWhat said false
2013-04-21T21:36:16-0700,true kinda expect name change Magic Light something US Fairy doesnt seem quite fit going new type Xerneas Fairy type particular doesnt seem fit
2013-04-21T21:44:02-0700,Agreed think Light Fairy Im hoping Jigglypuff becomes new type Jigglypuff definitely Normal
2013-04-21T21:58:31-0700,yugioh fairy TCG version OCG angelI dont know going work TCG though really really hope new type new type dont make use energy dont need 8They could make 18 types pokemon TCG still use basic 8 energy types saw water card used grass energy Megalo Cannon
2013-04-21T22:13:59-0700,matters Video Game world Like poison uses psychic energy fairy would normal type
2013-04-21T22:51:11-0700,Adding new type would create balance issues would think Maybe remove type normal together replace could work 4 gens new types added 650 pokemon may unbalance game
2013-04-22T00:31:32-0700,discussion Mewtwos new form clone eventually person proven right highly doubt Pokemon going announce obnoxious new type Magic Light franchises types think Pokemon might announce new type actually going better name Magic Light also think Sylveon Pokemon revealed might new type doubt Xerneas Yveltal new types would look completely unnatural Pokemon Ive played since Pokemon first came pattern Ive found Pokemon like keep things simple possible makes easier easier us agree vaporeons statement Pokemon messed completely got rid normal type new type WOULD screw game Like cant imagine Pokemon like Bravery Ursaring MagicLightFairy type imagine normal typed Pokemon different type Another thing go argument keeps going guys thinking youre going right topic probably end right likely reason Sylveon looking much different could first permanent female Eeveelution like Froslass Vespiquen way Sylveon stays Normal type Pokemon typing doesnt become complicated
2013-04-22T01:00:20-0700,could please drop elitist attitude matter right wrong
2013-04-22T01:07:48-0700,obvious new type pokemon called Newtype anyone watched Gundam
2013-04-22T07:12:29-0700,right wrong argue point think im right believe strongly dont tell people wrong im rightPlus public forum input always welcome would boring place people allowed post always right sources back
2013-04-22T08:36:43-0700,think would make complete sense new type called Light Weve Dark type longest time need Light balance could make Xerneas Yveltal Light Dark respectively
2013-04-22T08:56:43-0700,think Ill go play YuGiOh Pokemon somehow decides call new type light YuGiOh type called light goes call new type Magic Pokemon decides bash head call new type fairy Ill probably join bashing head
2013-04-22T09:06:10-0700,Wait Youre going go play another game instead Pokemon pokemon dares similar type name game Especially thingslike thishave existed whileFirst lol nonono
2013-04-22T09:36:13-0700,card game Light Pokemon Neo Destiny wouldnt complete stretchDrew
2013-04-22T09:51:06-0700,Thats breaking pointAt first going explain areas overlap two games taxonomical systems instead Ill point going worried Id worried aspects Pokmon seem lineup YuGiOh powerful oneperdeck cards potent high rarity cards shape formatOtherwise think getting LightMagicFairyWhatever Type badThe actual YuGiOh TCG opposed depicted fiction beforehand originally six elementalstyle Attributes Dark Earth Fire Light Water Wind Cards divided 20 TypesTribesFamilies Aqua Beast BeastWarrior Dinosaur Dragon Fairy Fiend Fish Insect Machine Plant Pyro Reptile Rock Sea Serpent Spellcaster Thunder Warrior WingedBeast ZombieAs wasnt enough kind redundant places next PsychicType added long time mangaanimvideo game Divine Attribute Divine Beast Type began showing actual cards even Type called Creator God exists asingle cardI even objecting jumping ship jump ship something better job worse lol
2013-04-22T15:50:32-0700,OK maybe reacting would like new type cooler name Magic Fairy Light Pokemon decide release new type names would hope new type Light way would make lot sense since DarkI dont think getting new type bad would like something Magic Fairy Im actually OK idea new type Light makes lot sense Dark really didnt need give lecture YuGiOh played Pokemon YuGiOh 2 years ago quit YuGiOh Trust Im going change games joking changing games Im still serious fairy type partYoure mistaken Light Pokemon whole history Pokemon TCG decks called Light Dark back Neo destiny Pokemon types
2013-04-22T16:39:56-0700,must say balance types game unbalanced dont see obvious oversight many people complain types balanced add new one basis absolutely clue balance Isnt obvious work make sure things balancedBesides stand theory Mewtwo gets additional type new form either makes resistant Bug type SE Bug Otherwise Mewtwo get stomped 5 Bug types considering weakness
2013-04-22T18:27:23-0700,Adding new type wouldnt provide balance type chart already incredibly unbalanced begin Fairy abstract ridiculous idea type dont know would able quantify existing nerfed types strong even somehow think adding another type would balance reasons
2013-04-22T18:48:07-0700,completely agree Pokemon need new type adding new type called Fairy completely retarded thing Im trouble understanding youre calling type chart unbalanced opinion type chart well balanced moment really wish Pokemon making us chase tails Sylveons type wont add new type unfortunately since Pokemon hasnt revealed Sylveons type yet four generations since new type added likely Pokemon add new type wish new type retarded type Fairy Magic
2013-04-22T19:08:01-0700,types bit unbalanced dont think adding new type going make worse Look Dark Steel think better added types seems like difficult concept people understand add many types want still able balance poor argument IMO
2013-04-22T19:12:25-0700,word note Dark type Pokemon like Dark type franchises Dark element franchises relate actual darkness opposite light night Ghosts zombies undead usually dark elementIn Pokemon undead pokemon moves deal night ghost type Dark type pokemon spies covert operations theft played RPGs typical moves thief class would make would dark type moves PokemonSo opposite Dark type pokemon would type goes head front entrance strength types like normal fighting useless ghost type Dark type super effective goes back door ghost least likely expect moveThat TCG darkness pokemon really good discarding opponents cards type steals things
2013-04-22T19:55:33-0700,Ive also heard Dark type considered dirty fighting might explain Darktype moves like Bite Faint Attack Foul Play Fake tears Taunt Fighting types supereffective Dark types looked upon pure fighters beat dirtyfighting Dark typesFighting types already opposite Dark Light type type goes head counter Dark doesnt make sense think would make confusing
2013-04-22T20:19:53-0700,think Fairy typing unlikely dont see would bad make anything would fairly interesting see actual fairies mythology rather unique balancing perspective could see similar traits dragons weaknesses resistances mixed aroundIve always found idea Light typing relatively silly Ive never seen real potential actual Pokemon concepts could adopt without appearing forced fairy typing hand could interesting potential fair number Pokemon already draw similar mythos ie Chandelure willowisps Plus franchise thats Dragons Ghosts Psychics since inception think itd fit right inI dont find overwhelmingly likely Id open idea personally
2013-04-22T20:24:32-0700,Balance sometimes best odd number used varietys sake Ex rock paper scissorsIf decide bring new type would hope keep type coverage odd number personally think odds better favor completing balanced circle nothing poweringNow far balanced goes think balance types good sits issue see game unbalanced actual number Pokemon specific type Water Pokemon highest attendence Dragon type short end dealIf anything abilities base stats total number count types balance needs adjustedTake Legendaries mini legendaries choices know Pokemon battle worthy competitive levelEach Pokemon design purpose sure battle worthy way looking add balance video game mean IMO focus adding Pokemon boost numbers rarely playednever used types add abilites open doors optionsIf Gamefreak decided add another types might bit sad honestly think areas Pokemon roster could use great boost adding usable Pokemon competitive levels playI would happy games getting restructure roster ability side Pokemon bit iffy new type added unless 2 new types would hope less populated Pokemon types gain severe gain higher quality base stated battle worthy Pokemon sake adding needed balance
2013-04-22T20:25:33-0700,dont see whats wrong new type adds depth game bad thing peoples eyes
2013-04-22T20:29:50-0700,think people think bad lack certain typesNotice gen 12 dark steel typesNow everything feel playing certain catch dual dark steelsomethingI think make new type whole lot balancing order might enrage fans lotLike collecting electric type pokemon sudden rotom switched light typeId probably pull hair
2013-04-22T20:33:37-0700,Red Blue Gold LeafgreenI might get back videogames new mewtwo thing
2013-04-22T20:36:43-0700,Pokemontrader Agreed idea Pokemon getting new type easily accept new form think would cool say Dragonite suddently became new typeOriginal original change good keeping roots foundation holds something kept building upon moving forward Sure repair patch keep original secure
2013-04-22T20:46:02-0700,addition adding Dark Metal game unbalance felt needed give types better worse matchups also made unique pokemon designs typing also making things like hidden power usefulThe problem see adding new type 650 pokemon later new type would pretty much exclusive gen 6 Im fairly confident sylveon would normal types shares many traits normal type pokemon argument sakes lets say new type type light dont really consider fairy type element Sylveon would Pokemon type revealed Lets say light type bad match dark bad matchup Pokemon based stat total 600 means light type would unbalanced Pokemon fairly advantage itAdding new type would create issue unless go back redesign every Pokemon Gen 6 know wont current track record BW think need work balancing Pokemon first increasing based stats older Pokemon compensate power creep make Flareon better better support 394 attack stat etc adding new types game Also changing Pokemon types take away whats special
2013-04-22T20:49:16-0700,Youre mistaken inNeo Destinywe got 20 Pokmon Light names intended balance Dark Pokmon confused DarknessTypes originally introduced theTeam Rocketexpansion also featured inNeo DestinyIf believe simply go Researching Tower switch Unlimited version pull theNeo DestinysetThe Type system Pokmon odd cant tell started classical elements started adding classical elements cultures started adding things struck fancy end result within Type Pokmon Type because1 manipulate element2 live element3 composed partially wholly element4 one aboveThat applies Types resemble elements FightingType doesnt fit instead FightingType apparently FightingType least vaguely humanoid cant even focus might considered Fighting techniques chi manipulation much overlap TypesIt irksome apparently knowing throw karate chop FightingType equal utilizing natural venoms PoisonType equal channeling power elements anything resembling elemental Type equal tapping power mind soul equal wings time FlyingTypeThere also Types feel pretty redundant like Rock Ground could EarthType possibly GrassTypes One also needs realize Type system pretty arbitrary begin often using video game elemental logic instead would actually happen equalequivalent Types faced
2013-04-22T20:57:24-0700,Really quote post LINK light pokemon tcg card STILL make ridiculous statement
2013-04-22T21:24:18-0700,terrible several things really unbalanced Steel resisting like twelve types course obvious one also hate Poison strong one type seven types resist Grass Ice one resistance Dragon bunch random elemental resistances resisted one type Water basically one actual weakness due Grass undesirable offensive typeevery Water Pokemon learning Ice Beam combat anywayPersonally Ive always disagreed notion Dark Steel necessary types balance Psychic broken RBY number reasons would fixed time namely fact Ghost moves glitch RBY made Psychic immune Ghosttype moves anyway good Bug Pokemon Bugtype moves fact Psychic caused 30 Special drop Special incorporated two different stats really didnt need create specific types nerf Psychics especially process made Steel ridiculously overpowered
2013-04-22T23:22:04-0700,Fairy Type eh dont even know possible new Pokemon Types Weaknesses Resistances new Type going added X looks possible next generation Pokemon games wont backwards compatible Black White Black 2 White 2 means kind change games core mechanics fine Gen V nobody able migratetransfer Pokemon new games Fall Worst case scenario would Game Freak adds new Stat statistics new Natures Characteristics IVs X compared predecessors remained since Gen III would cause another technological gap happened transition Gold Silver Crystal Ruby Sapphire Emerald Game Freak made FireRed LeafGreen Gameboy Advance Im hoping dont repeat new Type hasnt officially confirmed especially Serebiinet PokeBeach could rumor nowSome guys might think majority players play Pokemon video games competitively dont EVIV Train natural way instead speed process using cheating devices would illegal official VGC Tournaments PokeSav Action Replay get perfect flawless stats entire teams however theres Pokemon players like spent 45 years EV IV Training maybe 1520 Lv 100 Pokemon competitive battling whenever get chance effort wasted cause wasnt able migratetransfer EVIV Trained Pokemon BW2 XY would huge slap face Nintendo Game Freak Im sure way transfer since XY 3DS like BW2 yet really depends much video game franchises core mechanics changed theyre changed much transfer wont possible Dont get wrong idea competitive Pokemon players use cheating devices get flawless teams Pokemon video games trying make point remember hearing Junichi Masuda say Game Freak doesnt plans get rid able transfer Pokemon Gen V Gen VI XYMakes sense Game Freak could nerf Stealth Rocks since makes alot popular FireTypes like Charizard Flareon almost unplayable Flareon barely stand feet without getting screwed Earthquake Scald Surf Water Pulse Stone Edge kind stuck survive making Substitutes absorb attacks unless switch something resists Rock Ground Gliscor since doesnt take much damage entry hazards also Poison Heal gets around Toxic Spikes entry hazards competitive Pokemon video games Stealth Rocks commonly used less FireTypes played competitively aside Infernape many players run Rapid Spin
2013-04-23T00:19:33-0700,main gripe Stealth Rocks ability hit weakness damage switch broken Even entry hazards dont target every Pokemon absorb immune Stealth Rock would better damage based leftovers could take Pokemon losing 25 50 percent health switch fair
2013-04-23T10:54:15-0700,Things like Entry Hazards Weather teams made metagame stale last years way GameFreak alter metagame point nerf Entry Hazards Weather abilities Hopefully Fairy make game fresh giving players options work unique winning strategies know mean
2013-04-23T14:44:31-0700,Yeah little weird thiis big deal sudden always way never really thought anything since dont get whats bad little odd game isIn Gen 2 6 since 1st introduced Pokemon still beginning really theres dozens Im sure Xy thing happenAnd would anyone care Rotom light type like doesnt make sense Nobody going stop playing going live keep playing Thats close minded say oh well im going play anymore changed type sounds like mindless complaint name change best
2013-04-23T15:11:48-0700,isnt suddenly big deal First foremost came extension discussion Second annoyance Gen 1 longer remains problem becomes original games original Game Boy restrictive console develop games DS near limiting excuse keeping cluttered system retaining mechanic makes game worse usually good idea abandon itNow say dont get bad fine dont know adequately explain already without derailing thing everyone takes issue things
2013-04-23T15:48:59-0700,also bigger deal age internet never released information Pokemon like showing image know Sylveon normal type characteristics wigglytuff new type brings balance concerns big deal VG became recognizable TPI Pokemon taking Pokemon like training best new type creates balance problems VGC limits playing field EX Pokemon TCG VG decline well balance 800 pokemon
2013-04-23T16:03:23-0700,citation neededIts fact want fact
2013-04-23T16:49:06-0700,Ummyesyes Zekrom Reshiram unknown typings many fifth gen Pokemon upon first reveal reason Sylveon subject much speculation isnt immediately obvious breaks traditional naming conventions eevee family could mean somethingor time tellThere two major reasons problem One Pokemon intended competitive VGC part franchises appeal Pokemon intentions Stunfisk instance likely intended fun joke Two new type option unbalance add Fairy could great addition sure concerns comes change Also opinion things unbalanced decline Dont abuse declarative statements like beg
2013-04-23T16:55:16-0700,getting EX Pokemon unbalance TCG shows favoritism towards EX Pokemon regular Pokemon cant keep require resources get going Ex Pokemon levelI made comparison Pokemon EX new Pokemon type poorly executed Pokemon EX add new type game ends like EX new type Pokemon ends really powerful unbalance game low numbers put 650 PokemonSorry cant find source company admit poorly design execute something also never said fact observation made watching treating BW
2013-04-23T17:04:32-0700,Thats opinion feel like things decline also opinion Pokemon value ultra rares Pokemon competitive completely subjective fact says opinion respect may think game good opinion think bad opinionYou two seem think say fact discussion add Everything speculation everything based opinion
2013-04-23T17:31:42-0700,opinion though say people also making statements like saying game good Dont bias like
2013-04-23T17:52:16-0700,get EX Pokemon making TCG bad would new type make VG bad People play VG Tier system community knows balance game pretty well 800 pokemon wouldnt get balanced since preevolutions means end dont think Nintendo going go back fix every Pokemon nature monsters going better othersAnd would new type bad doubt new type going dominate Tier single handedly dominate anything unless made really poorly
2013-04-23T17:55:51-0700,Let reiterate problem posts state opinion fact thus declarative statement comes across saying opinion correct may intend thats fairly simple interpretation add something like feel think often point might understood opposed polarizing
2013-04-23T18:02:42-0700,Light Dark Pokemon ruining gameWait noPokemon ex ruining gameOh hold new developmentPokemon SP ruining gameOh nope sorry actuallyPokemon Prime ruining gameWhat apparentlyPokemon EX ruining game guysSubstitute appropriate VGC equivalents im lazy something weather spinhaze entry hazards steel type etc
2013-04-23T18:19:22-0700,means Im supporting opinion Im saying mine correct thats take
2013-04-23T18:27:12-0700,True like said idea new Types Weaknesses Resistances whole thread pure speculation point Also adding new Type like Fairy wouldnt nearly bad allowing every Pokemon know 6 moves instead 4 Someone mentioned thread earlier Pokemon intended competitive thats true ironically enough actually ways making Pokemon seem like arent competitive looks competitive Ive seen really good Lv 100 Magikarp entire team Legendaries YouTube Gen IV says alot
2013-04-23T18:50:33-0700,hate video much guy sweeping using competitive sets opponent wasnt experienced enough know deal Smeargle
2013-04-23T19:28:16-0700,dont recall complaint sure someone made give every complaint equal standing without appreciation towards common actually youll miss getting stuck rants lol
2013-04-23T19:38:14-0700,many years ago couldnt tell said common enough statement local league possible contained within central california however given every high end mechanic decried ruining game doubt vocal complainers light dark mechanic outside area well
2013-04-23T19:47:05-0700,approaching directionThe big complaint Light Pokmon really bad lol dont recall Dark Pokmon good either remember much complaining least justified Neoera Baby Pokmon several decks prove competitive
2013-04-24T07:09:35-0700,never written paper life Supporting opinion thesis words done giving wellthought andcitedfacts Omitting think feel opinion suddenly make opinion stronger PhD history ever worded thesis fact without giving strong supporting arguments based fact research study Theres reason thatYou feel free say youre worried VGC balancing issues example citing past occurences effects game even using public opinion saying something misleading
2013-04-24T08:08:31-0700,write papers time School daamanding right score high Ive played vg tcg since beginning Ive seen game best worst dont speak without knowledge first hand experience im debating experience enough base opinion right wrong also dont cite sources state tcg vg sources related competitive play bias support opinion events happened dont think feel skill read inbetween linesThe new Pokemon EX overpowered limit card pool without game betterThats opinion may think thats fine think Stealth Rocks overpowered limits pokemon used Pokemon lose 25 50 percent HP switch Thats opinion thinks strong one may think wise call skill also think opinions wellthoughtout never anything say fact
2013-04-24T08:20:33-0700,post things put words phrases like IMO think believe makes sound less mean would use another word nannybot open engagement rather closed make discussions present
2013-04-24T08:37:02-0700,Im adament others making point know opinion well Even put keywords still argue opinions stopped caring formal Im going say say topic something say move
2013-04-24T08:40:09-0700,Thats censorship anything else Id thought
2013-04-24T09:40:43-0700,know hope new type make things interesting new type
2013-04-24T10:33:22-0700,know put text Nothing nothing less
2013-04-24T11:03:34-0700,fault people cant tell something implied
2013-04-24T11:16:06-0700,Actually isSo dont imply change implication overt declaration add simple tags sentence Bullados suggested
2013-04-24T13:07:20-0700,work business world course read lines isnt point point way write comes extremely closedminded Im first tell open feedback criticism Thats problem people discussion comes give take open acceptance new ideas theories one correct one wrong think make seem like youre right one else
2013-04-24T14:11:07-0700,things considered facts peoples opinions Sometimes joke whats considered thesis since large collection peoples opinions reason regarded credible people higher authority realistically half things say different mePutting phrases waste time since assume everyone says opinion unless sort common knowledgeEither way Pokemon
2013-04-24T14:16:11-0700,statements make debate makes opinion support think makes sense want counter fine counter back would Please explain make seem Im right everyone else wrong Im debating know based past events never said fact dont know thread exist people debate thinkhappenSorry think Im hard debate youre going deal different debate points others wellThere many sources list IMO Think believe make things knows example smaller scale top 10 list worst Pokemon gen best Pokemon gen best game worst game larger scale NRA religion political organizations largely biased push agendas fact yet dont use IMO Think believe andsince big deal dont make points look decidable cant read lines able tell opinion stated Im dont know say
2013-04-24T15:57:02-0700,EmphasisaddedI think defeated point groups cited refer views opinions polite avoid potential litigation Otherwise consider views factual indeed would question religion adherents didnt consider basic tenets faith factual good reality defining beliefs one actually believes
2013-04-24T18:18:22-0700,Theres huge difference saying think overweight leads heart disease writing thesis several studies legitimate research done topic prove thesis LOT proof sentence stating someones opinion
2013-04-24T18:27:40-0700,immewnity Fair enough people know make know one God possibilitiesOtaku good point well groups extremely biased Nothing really say fact group people share opinion yet treat fact used though groups prove point forgot put PETA extremist list dont use keywords make points obvious stand firm opinions Im one person opinion opinion made stronger people share views opinion observation still validI basically supporting opinion thought strong argument others need keywords identify opinion short coming mine sudden people want cite sources validate claim dont one sources biased game good Ive played many formats deemed good bad watched power creep video games went opinion game state like otherI challenge anyone find official source Pokemon says Pokemon created competitive since citing became important sudden competitive subjective Fine official source saying know TCG good bad state Pokemon big difference opinionated organizations WAY people following
2013-04-24T18:34:59-0700,Thats backed facts research scientist validate Pokemon TCG VG facts backed research speak people speak think may change game Nothing factual Pokemon Pokemon makes soIt almost universal know thing Sabldonk bad game would ruined next large tournament Nations Worlds think released statement say next format would HGSS tournament keep game balanced nutshellWe cant compare Pokemon official backing happens Heart Disease back research
